{
  "dataset_id": "test_scan_pipeline_20260104",
  "measured_at": "2026-01-04T12:00:00Z",
  "anchors": [
    {
      "anchor_id": "A001",
      "model_xyz_mm": [0, 0, 0],
      "scan_xyz_mm": [1, 1, 1]
    },
    {
      "anchor_id": "A002",
      "model_xyz_mm": [1000, 0, 0],
      "scan_xyz_mm": [1001, 1, 1]
    },
    {
      "anchor_id": "A003",
      "model_xyz_mm": [0, 1000, 0],
      "scan_xyz_mm": [1, 1001, 1]
    },
    {
      "anchor_id": "A004",
      "model_xyz_mm": [1000, 1000, 0],
      "scan_xyz_mm": [1001, 1001, 1]
    },
    {
      "anchor_id": "B001",
      "model_xyz_mm": [0, 0, 5000],
      "scan_xyz_mm": [1, 1, 5001]
    },
    {
      "anchor_id": "B002",
      "model_xyz_mm": [1000, 1000, 5000],
      "scan_xyz_mm": [1001, 1001, 5001]
    }
  ],
  "parts": [
    {
      "part_id": "MULLION_PASS_WITHIN_TOL",
      "nominal_line_mm": { "p0": [500, 500, 0], "p1": [500, 500, 5000] },
      "scan_line_mm": { "p0": [503, 502, 1], "p1": [503, 502, 5001] },
      "pose_confidence": 0.9
    },
    {
      "part_id": "MULLION_NEEDS_CORRECTION",
      "nominal_line_mm": { "p0": [200, 200, 0], "p1": [200, 200, 5000] },
      "scan_line_mm": { "p0": [210, 208, 1], "p1": [210, 208, 5001] },
      "pose_confidence": 0.9
    },
    {
      "part_id": "MULLION_LARGE_ERROR",
      "nominal_line_mm": { "p0": [800, 800, 0], "p1": [800, 800, 5000] },
      "scan_line_mm": { "p0": [830, 825, 1], "p1": [830, 825, 5001] },
      "pose_confidence": 0.9
    }
  ]
}
